{
  "$schema": "https://json-schema.org/draft/2020-12/schema",
  "$id": "https://github.com/bramato/Pact/blob/main/specification/0.2/schemas/question.schema.json",
  "title": "PACT question v0.2",
  "type": "object",
  "additionalProperties": false,
  "required": [
    "question_id",
    "task_id",
    "prompt",
    "answer_schema",
    "required",
    "expires_at",
    "status"
  ],
  "properties": {
    "question_id": {
      "type": "string",
      "minLength": 1,
      "maxLength": 512
    },
    "task_id": {
      "type": "string",
      "minLength": 1,
      "maxLength": 512
    },
    "prompt": {
      "type": "string",
      "minLength": 1,
      "maxLength": 10000
    },
    "answer_schema": {
      "$ref": "https://github.com/bramato/Pact/blob/main/specification/0.2/schemas/schema-reference.schema.json"
    },
    "required": {
      "type": "boolean"
    },
    "expires_at": {
      "type": [
        "string",
        "null"
      ],
      "format": "date-time",
      "pattern": "^\\d{4}-\\d{2}-\\d{2}T\\d{2}:\\d{2}:\\d{2}(\\.\\d{1,3})?Z$"
    },
    "status": {
      "enum": [
        "open",
        "answered",
        "expired",
        "withdrawn"
      ]
    }
  }
}
